[
  {
    "claimId": "arduino-uno-rev3-io-current-20ma",
    "subjectId": "arduino-uno",
    "subjectType": "part",
    "claimType": "electrical-limit",
    "fieldPath": "electrical.maxCurrentMa",
    "value": 20,
    "units": "mA",
    "sourceTier": "manufacturer-official",
    "sourceTitle": "Arduino Uno Rev3 Tech Specs",
    "sourceUrl": "https://store.arduino.cc/products/arduino-uno-rev3",
    "sourceDateChecked": "2026-06-01",
    "evidenceQuote": "DC Current per I/O Pin 20 mA",
    "confidence": "high",
    "notes": "Used as the per-pin starter-circuit limit."
  },
  {
    "claimId": "arduino-uno-rev3-d9-pwm-pin",
    "subjectId": "arduino-uno:D9",
    "subjectType": "pin",
    "claimType": "pin-map",
    "fieldPath": "pins.D9.role",
    "value": "pwm-output",
    "sourceTier": "manufacturer-official",
    "sourceTitle": "Arduino Uno Rev3 Tech Specs",
    "sourceUrl": "https://store.arduino.cc/products/arduino-uno-rev3",
    "sourceDateChecked": "2026-06-01",
    "evidenceQuote": "PWM: 3, 5, 6, 9, 10, and 11.",
    "confidence": "high",
    "notes": "D9 is treated as PWM-capable in the canonical registry."
  },
  {
    "claimId": "arduino-uno-rev3-i2c-a4-a5",
    "subjectId": "arduino-uno",
    "subjectType": "pin",
    "claimType": "protocol-support",
    "fieldPath": "protocols.i2c.pins",
    "value": ["A4/SDA", "A5/SCL"],
    "sourceTier": "manufacturer-official",
    "sourceTitle": "Arduino Uno Rev3 Tech Specs",
    "sourceUrl": "https://store.arduino.cc/products/arduino-uno-rev3",
    "sourceDateChecked": "2026-06-01",
    "evidenceQuote": "TWI: A4 or SDA pin and A5 or SCL pin.",
    "confidence": "high",
    "notes": "Grounds canonical OLED I2C wiring for Uno."
  },
  {
    "claimId": "ssd1306-i2c-oled-vcc-gnd-sda-scl",
    "subjectId": "oled-i2c-096",
    "subjectType": "part",
    "claimType": "pin-map",
    "fieldPath": "pins",
    "value": ["VCC", "GND", "SDA", "SCL"],
    "sourceTier": "vendor-technical-guide",
    "sourceTitle": "Adafruit Monochrome OLED Breakouts",
    "sourceUrl": "https://learn.adafruit.com/monochrome-oled-breakouts?view=all",
    "sourceDateChecked": "2026-06-01",
    "evidenceQuote": "Microcontroller SDA to OLED Data",
    "confidence": "medium",
    "notes": "Applies to common SSD1306 I2C breakout pin naming; exact module variants still need source review before expansion."
  },
  {
    "claimId": "breadboard-row-continuity-5-hole",
    "subjectId": "breadboard-half",
    "subjectType": "board",
    "claimType": "breadboard-continuity",
    "fieldPath": "rendering.breadboardGrid.signalArea.rows.continuityGroup",
    "value": "five-hole terminal strips share continuity on each side of the center gap",
    "sourceTier": "vendor-technical-guide",
    "sourceTitle": "Adafruit Breadboards for Beginners",
    "sourceUrl": "https://learn.adafruit.com/breadboards-for-beginners/breadboards",
    "sourceDateChecked": "2026-06-01",
    "evidenceQuote": "The rows have 5 teeth",
    "confidence": "medium",
    "notes": "Used for simplified breadboard row continuity and hidden short detection."
  },
  {
    "claimId": "led-5mm-requires-current-limit",
    "subjectId": "led-5mm",
    "subjectType": "part",
    "claimType": "validation-rule",
    "fieldPath": "requiredPassives",
    "value": ["resistor-220"],
    "sourceTier": "educational-reference",
    "sourceTitle": "SparkFun Light-Emitting Diodes LEDs",
    "sourceUrl": "https://learn.sparkfun.com/tutorials/light-emitting-diodes-leds/all",
    "sourceDateChecked": "2026-06-01",
    "evidenceQuote": "Resistors limit the flow of electrons",
    "confidence": "medium",
    "notes": "The exact resistor value remains an H-eduware beginner default."
  },
  {
    "claimId": "led-5mm-anode-cathode-polarity",
    "subjectId": "led-5mm",
    "subjectType": "part",
    "claimType": "validation-rule",
    "fieldPath": "pins",
    "value": { "anode": "A", "cathode": "K" },
    "sourceTier": "educational-reference",
    "sourceTitle": "SparkFun Light-Emitting Diodes LEDs",
    "sourceUrl": "https://learn.sparkfun.com/tutorials/light-emitting-diodes-leds/all",
    "sourceDateChecked": "2026-06-01",
    "evidenceQuote": "Current flows from the anode to the cathode",
    "confidence": "medium",
    "notes": "Backs polarity checks and student-facing LED explanations."
  },
  {
    "claimId": "tactile-button-normally-open",
    "subjectId": "button-tactile",
    "subjectType": "part",
    "claimType": "validation-rule",
    "fieldPath": "simulationModel.type",
    "value": "digital-input-switch",
    "sourceTier": "vendor-technical-guide",
    "sourceTitle": "Adafruit Make It Switch",
    "sourceUrl": "https://learn.adafruit.com/make-it-switch/what-about-breadboard-switches",
    "sourceDateChecked": "2026-06-01",
    "evidenceQuote": "standard normally open switch",
    "confidence": "medium",
    "notes": "Used for pull-up or pull-down input validation and button simulation."
  },
  {
    "claimId": "piezo-buzzer-arduino-tone-output",
    "subjectId": "piezo-buzzer",
    "subjectType": "part",
    "claimType": "protocol-support",
    "fieldPath": "protocols",
    "value": ["gpio", "pwm"],
    "sourceTier": "manufacturer-official",
    "sourceTitle": "Arduino Audio Basics",
    "sourceUrl": "https://docs.arduino.cc/learn/programming/audio/",
    "sourceDateChecked": "2026-06-01",
    "evidenceQuote": "piezo buzzer is used to produce sounds",
    "confidence": "medium",
    "notes": "Supports the starter buzzer/tone capability without modeling acoustic behavior."
  },
  {
    "claimId": "micro-servo-three-wire-pwm-signal",
    "subjectId": "micro-servo",
    "subjectType": "part",
    "claimType": "pin-map",
    "fieldPath": "pins",
    "value": ["VCC", "GND", "SIG"],
    "sourceTier": "vendor-technical-guide",
    "sourceTitle": "Adafruit Using Servos With CircuitPython and Arduino",
    "sourceUrl": "https://learn.adafruit.com/using-servos-with-circuitpython/hardware",
    "sourceDateChecked": "2026-06-01",
    "evidenceQuote": "Servo motors have three wires",
    "confidence": "medium",
    "notes": "The same guide identifies the signal wire as PWM; H-eduware keeps high-current warnings in validation."
  }
]
